answer,human_answer,semantic_similarity,result
"Question: what was the worst stock price percentage down in a day for NVIDIA ?Context: Actually, look at NVIDIA's stock price. It was flat for 10 years in a row before it took off. Literally, NVIDIA stock—this is now 2012, 2013, 2014, 2015—doesn't trade above $5 a share. When the crypto winter hit in 2018 and the end of",80% in a day for Nvidia,0.5683653354644775,CORRECT
"Question: In 2012, What is the name of the competition against imageNet Database and what was the error rate compared to others & who won the competition?Context: We'll do this annually. Anyone, any team can submit their algorithms against the ImageNet database, and they'll compete to see who can get the lowest error rate, the most percentage of the images correct. This is","Algorithm Competition, 15% error rate compared to others,  university of Toronto won the competition",0.6157150864601135,CORRECT
"Question: What is NVIDIA free cash flow in billions  every year? Context: Even after you subtract all that out, 37% of every dollar that comes in gets to be kept by NVIDIA shareholders. Ben: Wow, that's one customer. I think they spent between $50-100 million that they paid NVIDIA for all of the compute in that cluster. This is really interesting",NVIDIA generate $8 billion of free cash flow every year,0.8064992427825928,CORRECT
" Ben: Speech recognition is a hidden Markov process where the computer that’s listening to the sounds to try to turn it into language doesn’t actually know English, right? There's a big difference there. It is a convolutional neural network, which is a branch of artificial intelligence called deep learning. Deep learning is new for this use case, but Ben,",The state of the art had evolved and RNN is sequential and has very short context window.,0.3890187442302704,INCORRECT
"Question: What did Jensen Huang say in the Stratechery interview in March 2023 about the year 2022?Context: Yes. David: Jensen Huang was a grad student at Stanford, as we talked about, while he's starting NVIDIA. Vince: Oh, cool. Also Easter egg in that talk, that was the day that the Jensen and Lori Huang Engineering Center at Stanford was dedicated","Jensen said that 2022 was a disappointing year, when Chat GPT was released.",0.4980320930480957,INCORRECT
"   What is CUDA? This is just a context, we get excited about a lot of stuff on Acquired. Just ignore that there's no real use case for it or market. I think CUDA is like one of the greatest business stories of the last 10 years, 20 years more. I searched LinkedIn for people who work at NVIDIA today and have the word CUDA",CUDA has a unified interface which is incredibly flexible and well-supported by a huge community.,0.5697334408760071,CORRECT
"Question: Where did the issuance of the first banknotes originate?Context: Then in England, in the late 1600s, that's when banks started issuing paper banknotes so that people didn't have to carry around whatever metal the currency was denominated in—silver, gold, seashells, or whatever. It turned out, that was a pretty good idea. Where do you",England,0.19428788125514984,INCORRECT
" Ben: Second one, for those asking about Bitcoin.Question: what happen on 2013 in relation to bitcoin Context: The 2011-2013 era was like the seed investment phase for Bitcoin. You invest in Bitcoin during that phase, it's like being a seed investor in Google, Facebook, or whatnot. Bitcoin's a whole separate thing. The pre-2011 era for Bitcoin was",Ross Ulbricht was Arrested,0.009360354393720627,INCORRECT
"Question: does bitcoin have a higher appreciation per year as compared to gold?Context: Obviously, not at the whim and in such great volume as USD is. One thing that Bitcoin proponents would espouse is that already—even when we're only 11 years into this—the money supply increases by less per year than gold does. Ben: By the way, did you know gold�",yes,0.05925647169351578,INCORRECT
" Of course, people probably know the story of the Winklevoss as part of the origin of Facebook and The Social Network. They are two twins who were a few years ahead of Mark Zuckerberg at Harvard. It really is like the early days of Bitcoin. The price of Bitcoin crashed 50% because they're doing 70% of the market. All the bubbles in the past, it was","They Investemented hiked up the bitcoin value and attracted traditional financial markets, increasing its legitimacy and accessibility",0.39681148529052734,INCORRECT
"Question: In February 1967, Warren Buffet decide to transform Berkshire into an insurance company. How much time did it take for Warrne Buffet to work out on a deal?Context: It's unclear how much Warren thought about this ahead of time or more like he was looking for something to buy for Berkshire. They work out a deal in 15 minutes; 15 minutes or less",15 minutes,0.4681151211261749,INCORRECT
" Ben: It's that a few million dollars by today's? That's a great stat, $100 at the beginning of Warren Buffett's career following them all the way through is over $26 million. The more incredible number, do you know what $100 invested in the Warren Buffett Partnerships in 1959 and held through Berkshire today would be worth today? Buffett's net worth is about","$175,000 ",0.3227579891681671,INCORRECT
"Question: On which day of the week did Warren Buffet talked with Lorimer and for how long?Context: In our last episode, we told the story of Warren Buffett in the years of running his own partnerships. Those 12 years leading up through 1969, when he shut it down after his best year ever and returned all the money to his investors. We then wandered the path with",On Saturday for 4 hours,0.3423978388309479,INCORRECT
" Ben: Yeah, they did one other thing that's worth calling out during this time period in the last few years and that's they launched WhatsApp Business, which is a second WhatsApp app that I installed on my phone that basically works a lot like WhatsApp but if you're a business and you're communicating with your customers through WhatsApp, this is optimized for business way to do it, which",Tencent,0.01267800759524107,INCORRECT
" David: This was a totally different era. The idea that a 13-year-old kid in this high school, this middle school would get access to share computer time, I can't imagine there are many other secondary schools in the country that were doing this. We are going to start in the mid-1970s, in the Soviet Union, in Ukraine, in a little village",w00w00,-0.0008626244962215424,INCORRECT
"Question: What business strategies did Jan used to increase the popularity of the WhatsApp product?Context: Ben: Yeah, they did one other thing that's worth calling out during this time period in the last few years and that's they launched WhatsApp Business, which is a second WhatsApp app that I installed on my phone that basically works a lot like WhatsApp but if you're a business and you","Changing the app's name was a growth hack to attract new users on a weekly basis, thereby ensuring the app would display as a new app. ",0.30643153190612793,INCORRECT
"Question: What company did Disney invest in and eventually purchase for the technology to enable their streaming services platform?Context: It has been tried before, famously with AOL-Time Warner and recently being tried with Comcast, NBCUniversal, and AT&T-Time Turner. But Disney has to compete against digital disruptors like Netflix who have successfully built their own distribution and content in-house.",BAMTech,0.2138109803199768,INCORRECT
"Question: What was the result of the shareholder no confidence bid against Bob Eisner after the failed Disney takeover bid by Comcast?Context: An astounding 43% of Disney shareholders vote no confidence at Eisner at the shareholder meeting. David:              It's so ironic here. This is I believe over 10 years ago at this point, Comcast actually once made a hostile takeover offer",43% No Confidence,0.43230515718460083,INCORRECT
"Question: What position did Bob Eisner have and in what company when Disney acquired it?Context: He then went on and became the president of Disney for two years or co-running Disney with Michael Eisner who was CEO. Eisner, to rewind back to him a little bit, is quite an interesting character. He had actually started his career at ABC, but he had",COO at Capital Cities,0.011116855777800083,INCORRECT
" DS: He asked Buffett a question. That quote we read, he was so overjoyed to be there.Question: What did Jeffrey Skilling say to the dean of Harvard Business School during his entrance interview?Context: He sits down with the folks there, he gives them the pitch, and they say to him, “I see that you didn't go to Harvard Business","""I'm fucking smart.""",0.32682353258132935,INCORRECT
"Question: What was the singular condition that Jeffrey Skilling requested before joining Enron?Context: It's happening. I think this is Skilling's first earnings call as actual CEO, number one of the company. In a very telling move, it tells you a lot about what you need to know about Jeff Skilling as a person. David: Where one Richard Grubman of",Market-to-market accounting,0.09216175973415375,INCORRECT
"Question: What historic event took investigative pressure off of Enron before its stock collapsed?Context: Ben: It feels like even if Enron hadn't started falling apart before September 11th, September11th would have been the trigger, because they had all this correlated risk. As soon as their stock stopped going up for any reason, then the whole thing would crumble. This was the",September 11th,0.36887457966804504,INCORRECT
"Question: How did Enron remove investments from its accounting books?Context: They devise this scheme that they become acquainted with through Arthur Andersen, through the accountants and auditors, of using special-purpose entities to package up these investments that they're making in producers, and get them off of the Enron books. It turns out, they learn through doing this, that at the",Special purpose entities,0.21011817455291748,INCORRECT
"Question: The fall of Enron is similar to what other bankruptcy from 2022?Context: Less than a year after its stock hit an all time high, Enron filed for the largest bankruptcy in American history to that point. Ben: Since then, there have actually been five Chapter 11 bankruptcies that are larger. Isn't that crazy that this was the largest at the time 20 years",FTX,0.046423252671957016,INCORRECT
"Question: What metrics did FTX judge itself by?Context: I think FTX is where I've bought it in the past. Ho: That's a great question. We use these rough metrics—whether it's 5X or 10X—when we don't know the business. Patrick: I tried to not check the metrics too often because when I wrote a book, I","Become the biggest crypto exchange, did we succeed in getting retail users, did we expand beyond crypto.",0.1814909130334854,INCORRECT
" Today, we sit here with Trip Hawkins, the founder of the most legendary gaming company in the world, Electronic Arts. Trip worked as an early employee at Apple computer as the director of strategy and marketing until 1982 before starting EA, taking it public, and later moving on to start other companies in the gaming space such as 3DO and Digital Chocolate. Trip is now a professor of practice",Sophomore year of high school,0.12465058267116547,INCORRECT
"Question: What was Trip Hawkins favtorite game growing up?Context: Of course, the home of Sonos, if you listened to that episode. Today, we sit here with Trip Hawkins, the founder of the most legendary gaming company in the world, Electronic Arts. I have to assume—almost no matter what age you are—if you’re listening to this show",Strat-O-Matic,-0.07287387549877167,INCORRECT
